{
  "algorithm": {
    "automatic_fallback": false,
    "implementation": "Open3D RaycastingScene exact triangle distance",
    "max_query_points": 1048576,
    "normal_sample_count": 11,
    "pyopengl_platform": "egl",
    "query_workers": -1,
    "ray_nsamples": 11,
    "resolution": 512,
    "sample_point_count": 10000000,
    "scan_count": 100,
    "scan_resolution": 400,
    "seed": 0,
    "sign_method": "ray_parity",
    "surface_point_method": "open3d"
  },
  "asset_id": "thai-statue",
  "canonical_paper_protocol": true,
  "finished_at_utc": "2026-07-21T19:12:44.725554+00:00",
  "grid": {
    "axis_order": "zyx",
    "coordinate_mapping": "paper coordinates [0,1]^3 = (xyz + 1) / 2",
    "distance_units": "normalized [-1,1] coordinate units",
    "dtype": "float32",
    "query_component_order": "xyz",
    "sample_locations": "inclusive linspace(-1, 1, resolution)",
    "shape": [
      512,
      512,
      512
    ],
    "sign_convention": "negative_inside"
  },
  "input": {
    "bytes": 190000131,
    "checksum": {
      "algorithm": "sha256",
      "value": "01470da9fc1241dcb4b075cc057ff6bf88d8dc721ce24b5847b9efdfbb8c0345"
    },
    "checksum_source": "checked-in manifest",
    "mesh": {
      "body_count": null,
      "faces": 10000000,
      "topology_check": "skipped above 2M faces to avoid a large temporary edge graph",
      "vertices": 4999996,
      "watertight": null,
      "winding_consistent": null
    },
    "path": "data/raw/sdf/meshes/xyzrgb_statuette.ply"
  },
  "known_limit": "The paper states that an unreleased C++/HIP converter was used; Open3D exact triangle distance with ray-parity signs is an auditable reproduction protocol, not a bit-exact implementation of that converter.",
  "normalization": {
    "center_subtracted": [
      -0.3613624572753906,
      7.546775817871094,
      1.7582855224609375
    ],
    "formula": "p_normalized = (p - bbox_center) * isotropic_scale",
    "isotropic_scale": 0.005049979470202937,
    "method": "axis_aligned_bounding_box",
    "normalized_domain": [
      -1.0,
      1.0
    ],
    "original_bounds": [
      [
        -117.97333526611328,
        -190.4738311767578,
        -99.82234954833984
      ],
      [
        117.2506103515625,
        205.5673828125,
        103.33892059326172
      ]
    ],
    "original_extents": [
      235.22394561767578,
      396.0412139892578,
      203.16127014160156
    ]
  },
  "output": {
    "bytes": 536871040,
    "checksum": {
      "algorithm": "sha256",
      "value": "87f64ba60815f49c9e317ba861ebd8648e4dd726817e3d86df4db9aa8ef51240"
    },
    "continuity_limit_over_spacing": 1.5,
    "grid_spacing": 0.003913894324853229,
    "max_neighbor_delta": 0.003932646010071039,
    "max_neighbor_delta_over_spacing": 1.0047910555731505,
    "maximum": 1.3428497314453125,
    "minimum": -0.2218431830406189,
    "negative_fraction": 0.03609740734100342,
    "path": "data/processed/sdf/thai-statue/sdf_512.npy",
    "positive_fraction": 0.963902585208416
  },
  "paper_name": "Thai Statue",
  "paper_protocol": {
    "automatic_fallback": false,
    "axis_order": "zyx",
    "backend_dependency": "open3d==0.19.0",
    "centered_query_domain": [
      -1.0,
      1.0
    ],
    "coordinate_domain": [
      0.0,
      1.0
    ],
    "distance_units": "normalized [-1,1] coordinate units",
    "dtype": "float32",
    "legacy_backend_parameters": "scan_count, scan_resolution, sample_point_count, normal_sample_count, and seed are retained only for explicit non-canonical scan/sample overrides; they do not affect the Open3D canonical path.",
    "normal_sample_count": 11,
    "normalization": "Subtract axis-aligned bounding-box center; isotropically scale the largest extent to 2.",
    "paper_ambiguity": "The authors state that an unreleased C++/HIP converter produced 512^3 values. Open3D exact point-to-triangle distance with eleven-ray parity voting is a deterministic, auditable approximation that remains robust to Lucy's documented topology defects, but is not a bit-exact reconstruction of that converter.",
    "query_component_order": "xyz",
    "ray_nsamples": 11,
    "resolution": 512,
    "sample_locations": "inclusive linspace(-1, 1, 512)",
    "sample_point_count": 10000000,
    "scan_count": 100,
    "scan_resolution": 400,
    "seed": 0,
    "sign_convention": "negative_inside",
    "sign_method": "ray_parity",
    "surface_point_method": "open3d"
  },
  "raw_volume_git_ignored": true,
  "schema_version": 1,
  "software": {
    "mesh-to-sdf": "0.0.15",
    "numpy": "2.4.4",
    "open3d": "0.19.0",
    "python": "3.12.3",
    "scipy": "1.18.0",
    "trimesh": "4.12.2"
  },
  "started_at_utc": "2026-07-21T19:11:45.809574+00:00",
  "tracked_provenance_copy": true
}
